Title,Rating,Directors,Release Date,Writers,Actors,Production Company,Plot Summary,Genres,Parental Guide,Country of Origin,Languages,Runtime,Box Office,Budget
Mystic River,7.9,Clint Eastwood,2003,"Brian Helgeland, Dennis Lehane","Sean Penn, Tim Robbins, Kevin Bacon, Emmy Rossum, Laurence Fishburne, Marcia Gay Harden, Laura Linney, Kevin Chapman, Tom Guiry, Spencer Treat Clark, Andrew Mackin, Adam Nelson, Robert Wahlberg, Jenny O'Hara, John Doman, Cameron Bowen, Jason Kelly, Connor Paolo","NPV Entertainment, Warner Bros., Village Roadshow Pictures",,"Psychological Thriller, Suspense Mystery, Crime, Drama, Mystery, Thriller",R,"United States, Australia",English,2h 18m,"$156,595,191","$25,000,000 (estimated)"
Sicario,7.7,Denis Villeneuve,2015,Taylor Sheridan,"Emily Blunt, Josh Brolin, Benicio Del Toro, Jon Bernthal, Victor Garber, Daniel Kaluuya, Jeffrey Donovan, Raoul Max Trujillo, Julio Cesar Cedillo, Hank Rogerson, Bernardo Saracino, Maximiliano Hernández, Kevin Wiggins, Edgar Arreola, Kim Larrichio, Jesus Nevarez-Castillo, Dylan Kenin, John Trejo","Lionsgate, Black Label Media, Thunder Road Pictures",,"Contemporary Western, Cop Drama, Drug Crime, Action, Crime, Drama, Mystery, Thriller",R,"United States, Mexico, Hong Kong","English, Spanish, Ukrainian",2h 1m,"$84,997,446","$30,000,000 (estimated)"
The Bourne Supremacy,7.7,Paul Greengrass,2004,"Robert Ludlum, Tony Gilroy","Matt Damon, Franka Potente, Joan Allen, Brian Cox, Julia Stiles, Karl Urban, Gabriel Mann, Marton Csokas, Tom Gallop, John Bedford Lloyd, Ethan Sandler, Michelle Monaghan, Karel Roden, Tomas Arana, Oksana Akinshina, Yevgeni Sitokhin, Marina Weis, Tim Griffin","The Kennedy/Marshall Company, Motion Picture THETA Produktionsgesellschaft, Universal Pictures",,"One-Person Army Action, Spy, Action, Thriller",PG-13,"United States, Germany, India, Russia","English, Russian, German, Italian",1h 48m,"$292,542,992","$75,000,000 (estimated)"
Dawn of the Planet of the Apes,7.6,Matt Reeves,2014,"Mark Bomback, Amanda Silver, Rick Jaffa","Gary Oldman, Keri Russell, Andy Serkis, Kodi Smit-McPhee, Jason Clarke, Toby Kebbell, Kirk Acevedo, Nick Thurston, Terry Notary, Karin Konoval, Judy Greer, Jon Eyez, Enrique Murciano, Larramie Doc Shaw, Lee Ross, Keir O'Donnell, Kevin Rankin, Jocko Sims","Ingenious Media, Chernin Entertainment, Twentieth Century Fox",,"Dystopian Sci-Fi, Action, Adventure, Drama, Sci-Fi, Thriller",PG-13,"United States, United Kingdom, Canada","English, American Sign Language",2h 10m,"$710,644,566","$170,000,000 (estimated)"
Back to the Future Part III,7.4,Robert Zemeckis,1990,"Bob Gale, Robert Zemeckis","Michael J. Fox, Christopher Lloyd, Mary Steenburgen, Tom Wilson, Lea Thompson, Elisabeth Shue, Matt Clark, Richard Dysart, Pat Buttram, Harry Carey Jr., Dub Taylor, James Tolkan, Marc McClure, Wendie Jo Sperber, Jeffrey Weissman, Christopher Wynne, Sean Sullivan, Mike Watson","Amblin Entertainment, U-Drive Productions, Universal Pictures",,"Car Action, Desert Adventure, High-Concept Comedy, Steampunk, Teen Adventure, Teen Comedy, Time Travel, Adventure, Comedy, Sci-Fi",PG,United States,English,1h 58m,"$245,077,583","$40,000,000 (estimated)"
Cars,7.3,"Joe Ranft, John Lasseter",2006,"Joe Ranft, Jorgen Klubien, John Lasseter","Owen Wilson, Bonnie Hunt, Paul Newman, Larry the Cable Guy, Cheech Marin, Tony Shalhoub, Guido Quaroni, Jenifer Lewis, Paul Dooley, Michael Wallis, George Carlin, Katherine Helmond, John Ratzenberger, Joe Ranft, Michael Keaton, Richard Petty, Jeremy Piven, Bob Costas","Pixar Animation Studios, Walt Disney Pictures",,"Computer Animation, Motorsport, Adventure, Animation, Comedy, Family, Sport",G,United States,"English, Italian, Japanese, Yiddish",1h 56m,"$461,996,328","$120,000,000 (estimated)"
The Day After Tomorrow,6.5,Roland Emmerich,2004,"Roland Emmerich, Jeffrey Nachmanoff","Dennis Quaid, Jake Gyllenhaal, Emmy Rossum, Dash Mihok, Jay O. Sanders, Sela Ward, Austin Nichols, Arjay Smith, Tamlyn Tomita, Sasha Roiz, Ian Holm, Nassim Sharara, Carl Alacchi, Kenneth Welsh, Michel 'Gish' Abou-Samah, Robin Wilcock, Jason Blicker, Kenneth Moskow","Lionsgate, Centropolis Entertainment, Twentieth Century Fox",,"Disaster, Survival, Action, Adventure, Sci-Fi, Thriller",PG-13,United States,"English, Japanese, French, Arabic",2h 4m,"$552,639,571","$125,000,000 (estimated)"
The Theory of Everything,7.7,James Marsh,2014,"Jane Hawking, Anthony McCarten","Eddie Redmayne, Felicity Jones, Tom Prior, Sophie Perry, Finlay Wright-Stephens, Harry Lloyd, Alice Orr-Ewing, David Thewlis, Thomas Morrison, Michael Marcus, Gruffudd Glyn, Paul Longley, Emily Watson, Guy Oliver-Watts, Simon McBurney, Lucy Chappell, Charlotte Hope, Abigail Cruttenden","Fuji Television Network (Fuji TV), Working Title Films, Dentsu Motion Pictures",,"Docudrama, Medical Drama, Biography, Drama, Romance",PG-13,"United Kingdom, Japan, United States","English, French, Ukrainian",2h 3m,"$123,726,688","$15,000,000 (estimated)"
The Devil Wears Prada,6.9,David Frankel,2006,"Lauren Weisberger, Aline Brosh McKenna","Anne Hathaway, Meryl Streep, Adrian Grenier, Emily Blunt, Stanley Tucci, Simon Baker, Tracie Thoms, Rich Sommer, Daniel Sunjata, David Marshall Grant, James Naughton, Tibor Feldman, Rebecca Mader, Jimena Hoyos, Gisele Bündchen, George C. Wolfe, John Rothman, Stephanie Szostak","Major Studio Partners, Fox 2000 Pictures, Dune Entertainment",,"Workplace Drama, Comedy, Drama",PG-13,"United States, France","English, French",1h 49m,"$326,717,337","$35,000,000 (estimated)"
Sherlock Holmes: A Game of Shadows,7.4,Guy Ritchie,2011,"Arthur Conan Doyle, Michele Mulroney, Kieran Mulroney","Robert Downey Jr., Jude Law, Jared Harris, Rachel McAdams, Noomi Rapace, Stephen Fry, Paul Anderson, Kelly Reilly, Geraldine James, Eddie Marsan, William Houston, Wolf Kahler, Iain Mitchell, Jack Laskey, Patricia Slater, Karima McAdams, Richard Cunningham, Marcus Shakesheff","Warner Bros., Village Roadshow Pictures, Silver Pictures",,"Whodunnit, Action, Adventure, Mystery",PG-13,United States,"English, French, Italian, German, Romany",2h 9m,"$543,848,418","$125,000,000 (estimated)"
The Thing,8.2,John Carpenter,1982,"John W. Campbell Jr., Bill Lancaster","Kurt Russell, Wilford Brimley, Keith David, Richard Masur, T.K. Carter, David Clennon, Richard Dysart, Charles Hallahan, Peter Maloney, Donald Moffat, Joel Polis, Thomas G. Waites, Norbert Weisser, Larry Franco, Nate Irwin, William Zeman, Adrienne Barbeau, John Carpenter","Turman-Foster Company, Universal Pictures, Province of BC, Ministry of Tourism, Film Promotion Office",,"Alien Invasion, Body Horror, Monster Horror, Supernatural Horror, Tragedy, Horror, Mystery, Sci-Fi",R,"United States, Canada","English, Norwegian",1h 49m,"$20,836,490","$15,000,000 (estimated)"
Beauty and the Beast,8.0,"Kirk Wise, Gary Trousdale",1991,"Chris Sanders, Linda Woolverton, Brenda Chapman","Paige O'Hara, Robby Benson, Jesse Corti, Rex Everhart, Angela Lansbury, Jerry Orbach, Bradley Pierce, David Ogden Stiers, Richard White, Jo Anne Worley, Mary Kay Bergman, Brian Cummings, Alvin Epstein, Tony Jay, Alec Murphy, Kimmy Robertson, Hal Smith, Kath Soucie","Walt Disney Animation Studios, Walt Disney Pictures, Silver Screen Partners IV",,"Dark Fantasy, Fairy Tale, Fantasy Epic, Hand-Drawn Animation, Romantic Epic, Animation, Family, Fantasy, Musical, Romance",G,"United States, Japan","English, French",1h 24m,"$451,291,298","$25,000,000 (estimated)"
Training Day,7.8,Antoine Fuqua,2001,David Ayer,"Denzel Washington, Ethan Hawke, Scott Glenn, Tom Berenger, Harris Yulin, Raymond J. Barry, Cliff Curtis, Dr. Dre, Snoop Dogg, Macy Gray, Charlotte Ayanna, Eva Mendes, Nick Chinlund, Jaime Gomez, Raymond Cruz, Noel Gugliemi, Samantha Esteban, Richard Browner","NPV Entertainment, Warner Bros., Village Roadshow Pictures",,"Cop Drama, Drug Crime, Gangster, Police Procedural, Tragedy, Crime, Drama, Thriller",R,United States,"English, Russian, Spanish, Korean, Greek",2h 2m,"$104,876,233","$45,000,000 (estimated)"
Justice League,6.0,Zack Snyder,2017,"Joe Shuster, Chris Terrio, Jerry Siegel","Ben Affleck, Gal Gadot, Jason Momoa, Ezra Miller, Henry Cavill, Amy Adams, Ray Fisher, Jeremy Irons, Diane Lane, Connie Nielsen, J.K. Simmons, Ciarán Hinds, Amber Heard, Joe Morton, Lisa Loven Kongsli, Ingvar Sigurdsson, David Thewlis, Sergi Constance","RatPac Entertainment, DC Entertainment, Warner Bros.",,"Superhero, Action, Adventure, Fantasy, Sci-Fi",PG-13,"United States, Canada, United Kingdom","English, Irish Gaelic, Russian, Icelandic",2h,"$661,326,987","$300,000,000 (estimated)"
War of the Worlds,6.5,Steven Spielberg,2005,"David Koepp, Josh Friedman, H.G. Wells","Tom Cruise, Dakota Fanning, Tim Robbins, Miranda Otto, Justin Chatwin, Rick Gonzalez, Yul Vazquez, Lenny Venito, Lisa Ann Walter, Ann Robinson, Gene Barry, David Alan Basche, Roz Abrams, Michael Brownlee, Camillia Monet, Marlon Young, John Eddins, Peter Gerety","Dreamworks Pictures, Paramount Pictures, Amblin Entertainment",,"Action Epic, Adventure Epic, Alien Invasion, Disaster, Sci-Fi Epic, Urban Adventure, Action, Adventure, Sci-Fi",PG-13,United States,English,1h 57m,"$603,873,504","$132,000,000 (estimated)"
Gangs of New York,7.5,Martin Scorsese,2002,"Jay Cocks, Steven Zaillian, Kenneth Lonergan","Leonardo DiCaprio, Cameron Diaz, Daniel Day-Lewis, Jim Broadbent, John C. Reilly, Henry Thomas, Liam Neeson, Brendan Gleeson, Gary Lewis, Stephen Graham, Eddie Marsan, Alec McCowen, David Hemmings, Lawrence Gilliard Jr., Cara Seymour, Roger Ashton-Griffiths, Peter-Hugo Daly, Cian McCormack","Miramax, Initial Entertainment Group (IEG), Touchstone Pictures",,"Costume Drama, Epic, Gangster, Period Drama, Crime, Drama",R,"United States, Italy","English, Irish Gaelic, Chinese, Latin",2h 47m,"$193,772,504","$100,000,000 (estimated)"
Saw,7.6,James Wan,2004,"Leigh Whannell, James Wan","Cary Elwes, Leigh Whannell, Danny Glover, Ken Leung, Dina Meyer, Mike Butters, Paul Gutrecht, Michael Emerson, Benito Martinez, Shawnee Smith, Makenzie Vega, Monica Potter, Ned Bellamy, Alexandra Bokyun Chun, Avner Garbi, Tobin Bell, Oren Koules, Hans Raith",Twisted Pictures,,"Splatter Horror, Horror, Mystery, Thriller",R,United States,English,1h 43m,"$104,004,218","$1,200,000 (estimated)"
The Last Samurai,7.8,Edward Zwick,2003,"Edward Zwick, Marshall Herskovitz, John Logan","Tom Cruise, Ken Watanabe, Billy Connolly, William Atherton, Chad Lindberg, Ray Godshall Sr., Tony Goldwyn, Masato Harada, Masashi Odate, John Koyama, Timothy Spall, Shichinosuke Nakamura, Togo Igawa, Satoshi Nikaido, Shintaro Wada, Shin Koyamada, Hiroyuki Sanada, Shun Sugata","The Bedford Falls Company, Warner Bros., Cruise/Wagner Productions",,"Action Epic, Period Drama, Samurai, Sword & Sandal, Tragedy, Action, Drama",R,"United States, New Zealand, Japan","English, Japanese, Spanish, Danish",2h 34m,"$454,627,263","$140,000,000 (estimated)"
Mission: Impossible,7.2,Brian De Palma,1996,"David Koepp, Bruce Geller, Steven Zaillian","Tom Cruise, Jon Voight, Emmanuelle Béart, Henry Czerny, Jean Reno, Ving Rhames, Kristin Scott Thomas, Vanessa Redgrave, Ingeborga Dapkunaite, Valentina Yakunina, Marek Vasut, Nathan Osgood, John McLaughlin, Rolf Saxon, Karel Dobrý, Andreas Wisniewski, David Shaeffer, Rudolf Pechan","Cruise/Wagner Productions, Paramount Pictures",,"Spy, Urban Adventure, Action, Adventure, Thriller",PG-13,United States,"English, French, Czech",1h 50m,"$457,696,391","$80,000,000 (estimated)"
Aladdin,8.0,"John Musker, Ron Clements",1992,"John Musker, Ron Clements, Ted Elliott","Scott Weinger, Robin Williams, Linda Larkin, Jonathan Freeman, Frank Welker, Gilbert Gottfried, Douglas Seale, Charlie Adler, Jack Angel, Corey Burton, Philip L. Clarke, Jim Cummings, Jennifer Darling, Debi Derryberry, Bruce Gooch, Jerry Houser, Vera Lockwood, Sherry Lynn","Walt Disney Feature Animation, Walt Disney Pictures, Walt Disney Animation Studios",,"Desert Adventure, Fairy Tale, Feel-Good Romance, Hand-Drawn Animation, Pop Musical, Adventure, Animation, Comedy, Family, Fantasy",G,United States,English,1h 30m,"$504,050,219","$28,000,000 (estimated)"
The Hurt Locker,7.5,Kathryn Bigelow,2008,Mark Boal,"Jeremy Renner, Anthony Mackie, Brian Geraghty, Guy Pearce, Ralph Fiennes, David Morse, Evangeline Lilly, Christian Camargo, Suhail Dabbach, Christopher Sayegh, Nabil Koni, Sam Spruell, Sam Redford, Feisal Sadoun, Barrie Rice, Imad Dadudi, Erin Gann, Justin Campbell","Grosvenor Park Media, Voltage Pictures, Film Capital Europe Funds (FCEF )",,"Drama, Thriller, War",R,"United States, Luxembourg","English, Arabic",2h 11m,"$49,259,766","$15,000,000 (estimated)"
The 40-Year-Old Virgin,7.1,Judd Apatow,2005,"Judd Apatow, Steve Carell","Steve Carell, Catherine Keener, Paul Rudd, Romany Malco, Seth Rogen, Elizabeth Banks, Leslie Mann, Jane Lynch, Gerry Bednob, Shelley Malil, Kat Dennings, Jordan Masterson, Chelsea Smith, Jonah Hill, Erica Vittina Phillips, Marika Dominczyk, Mindy Kaling, Mo Collins","Apatow Productions, Universal Pictures",,"Feel-Good Romance, Raunchy Comedy, Romantic Comedy, Comedy, Romance",R,United States,"English, Spanish, Japanese",1h 56m,"$177,378,645","$26,000,000 (estimated)"
Quantum of Solace,6.5,Marc Forster,2008,"Neal Purvis, Paul Haggis, Robert Wade","Daniel Craig, Olga Kurylenko, Mathieu Amalric, Judi Dench, Giancarlo Giannini, Gemma Arterton, Jeffrey Wright, David Harbour, Jesper Christensen, Anatole Taubman, Rory Kinnear, Tim Pigott-Smith, Joaquín Cosio, Fernando Guillén Cuervo, Jesús Ochoa, Lucrezia Lante della Rovere, Glenn Foster, Paul Ritter","Columbia Pictures, Eon Productions, Metro-Goldwyn-Mayer (MGM)",,"Spy, Action, Adventure, Mystery, Thriller",PG-13,"United Kingdom, United States, Italy","English, Spanish, Italian, French, Swiss German, German",1h 46m,"$589,593,688","$200,000,000 (estimated)"
Moneyball,7.6,Bennett Miller,2011,"Stan Chervin, Aaron Sorkin, Steven Zaillian","Brad Pitt, Robin Wright, Jonah Hill, Philip Seymour Hoffman, Chris Pratt, Stephen Bishop, Reed Diamond, Brent Jennings, Ken Medlock, Tammy Blanchard, Jack McGee, Vyto Ruginis, Nick Searcy, Glenn Morshower, Casey Bond, Nick Porrazzo, Kerris Dorsey, Arliss Howard","Columbia Pictures, Scott Rudin Productions, Michael De Luca Productions",,"Baseball, Docudrama, Biography, Drama, Sport",PG-13,United States,English,2h 13m,"$110,206,216","$50,000,000 (estimated)"
Elysium,6.6,Neill Blomkamp,2013,Neill Blomkamp,"Matt Damon, Jodie Foster, Sharlto Copley, Alice Braga, Diego Luna, Wagner Moura, William Fichtner, Brandon Auret, Josh Blacker, Emma Tremblay, Jose Pablo Cantillo, Maxwell Perry Cotton, Faran Tahir, Adrian Holmes, Jared Keeso, Carly Pope, Ona Grauer, Michael Shanks","Media Rights Capital (MRC), QED International, TriStar Pictures",,"Cyberpunk, Dystopian Sci-Fi, Sci-Fi Epic, Action, Drama, Sci-Fi, Thriller",R,"United States, Canada","English, Spanish, French, Afrikaans",1h 49m,"$286,140,700","$115,000,000 (estimated)"
Scott Pilgrim vs. the World,7.6,Edgar Wright,2010,"Bryan Lee O'Malley, Michael Bacall, Edgar Wright","Michael Cera, Mary Elizabeth Winstead, Kieran Culkin, Anna Kendrick, Alison Pill, Aubrey Plaza, Jason Schwartzman, Johnny Simmons, Mark Webber, Ellen Wong, Satya Bhabha, Will Bowes, Celine Lepage, Keita Saitou, Mark LeRoy, Kjartan Hewitt, Ben Lewis, Nelson Franklin","Big Talk Productions, Universal Pictures, Marc Platt Productions",,"High-Concept Comedy, Romantic Comedy, Teen Comedy, Teen Fantasy, Teen Romance, Action, Comedy, Fantasy, Romance",PG-13,"United States, United Kingdom, Canada, Japan",English,1h 52m,"$51,824,861","$60,000,000 (estimated)"
Spectre,6.8,Sam Mendes,2015,"Neal Purvis, Robert Wade, John Logan","Daniel Craig, Christoph Waltz, Léa Seydoux, Ralph Fiennes, Monica Bellucci, Ben Whishaw, Naomie Harris, Dave Bautista, Andrew Scott, Rory Kinnear, Jesper Christensen, Alessandro Cremona, Stephanie Sigman, Tenoch Huerta, Adriana Paz, Domenico Fortunato, Marco Zingaro, Stefano Elfi DiClaudia","Columbia Pictures, B24, Danjaq",,"Globetrotting Adventure, One-Person Army Action, Spy, Action, Adventure, Thriller",PG-13,"United Kingdom, United States, Morocco, Italy, Austria, Canada, Mexico","English, German, Italian, Spanish, French, Ukrainian",2h 28m,"$880,707,597","$245,000,000 (estimated)"
Citizen Kane,8.3,Orson Welles,1941,"John Houseman, Orson Welles, Herman J. Mankiewicz","Orson Welles, Joseph Cotten, Dorothy Comingore, Agnes Moorehead, Ruth Warrick, Ray Collins, Erskine Sanford, Everett Sloane, William Alland, Paul Stewart, George Coulouris, Fortunio Bonanova, Gus Schilling, Philip Van Zandt, Georgia Backus, Harry Shannon, Sonny Bupp, Buddy Swan","RKO Radio Pictures, Mercury Productions",,"Epic, Period Drama, Tragedy, Drama, Mystery",PG,United States,"English, Italian",1h 59m,"$1,707,754","$839,727 (estimated)"
Horrible Bosses,6.9,Seth Gordon,2011,"Michael Markowitz, John Francis Daley, Jonathan Goldstein","Jason Bateman, Charlie Day, Jason Sudeikis, Steve Wiebe, Kevin Spacey, Lindsay Sloane, Michael Albala, Jennifer Aniston, Jennifer Hasty, Reginald Ballard, George Back, Barry Livingston, Meghan Markle, Donald Sutherland, Celia Finkelstein, Colin Farrell, John Francis Daley, Scott Rosendall","Rat Entertainment, New Line Cinema",,"Dark Comedy, Comedy, Crime",R,United States,English,1h 38m,"$209,838,559","$35,000,000 (estimated)"
Bullet Train,7.3,David Leitch,2022,"Zak Olkewicz, Kôtarô Isaka","Brad Pitt, Joey King, Aaron Taylor-Johnson, Brian Tyree Henry, Andrew Koji, Hiroyuki Sanada, Michael Shannon, Sandra Bullock, Bad Bunny, Logan Lerman, Zazie Beetz, Masi Oka, Karen Fukuhara, Kevin Akiyoshi Ching, Minchi Murakami, Kaori Taketani, Toshitaka Katsumi, Jim Garrity","Columbia Pictures, TSG Entertainment, 87North",,"One-Person Army Action, Action, Comedy, Thriller",R,"United States, Japan","English, Japanese, Spanish, Russian",2h 7m,"$239,268,602","$85,900,000 (estimated)"
The Mummy,7.1,Stephen Sommers,1999,"Stephen Sommers, Lloyd Fonvielle, Kevin Jarre","Brendan Fraser, Rachel Weisz, John Hannah, Arnold Vosloo, Kevin J. O'Connor, Jonathan Hyde, Oded Fehr, Erick Avari, Stephen Dunham, Corey Johnson, Tuc Watkins, Omid Djalili, Aharon Ipalé, Bernard Fox, Patricia Velasquez, Carl Chase, Mohammed Afifi, Abderrahim El Aadili","Universal Studios, Alphaville Films",,"Desert Adventure, Globetrotting Adventure, Quest, Supernatural Fantasy, Action, Adventure, Fantasy",PG-13,United States,"English, Egyptian (Ancient), Arabic, Chinese, Hebrew, Hungarian",2h 4m,"$417,643,286","$80,000,000 (estimated)"
X-Men: Apocalypse,6.8,Bryan Singer,2016,"Simon Kinberg, Bryan Singer, Michael Dougherty","James McAvoy, Michael Fassbender, Jennifer Lawrence, Nicholas Hoult, Oscar Isaac, Rose Byrne, Evan Peters, Josh Helman, Sophie Turner, Tye Sheridan, Lucas Till, Kodi Smit-McPhee, Ben Hardy, Alexandra Shipp, Lana Condor, Olivia Munn, Warren Scherer, Rochelle Okoye","TSG Entertainment, Twentieth Century Fox, Marvel Entertainment",,"Superhero, Action, Adventure, Sci-Fi",PG-13,United States,"English, Polish, German, Arabic, Egyptian (Ancient)",2h 24m,"$543,934,105","$178,000,000 (estimated)"
In Bruges,7.9,Martin McDonagh,2008,Martin McDonagh,"Colin Farrell, Brendan Gleeson, Ciarán Hinds, Elizabeth Berrington, Rudy Blomme, Olivier Bonjour, Mark Donovan, Ann Elsley, Jean-Marc Favorin, Ralph Fiennes, Eric Godon, Zeljko Ivanek, Sachi Kimura, Anna Madeley, Louis Nummy, Clémence Poésy, Jordan Prentice, Jérémie Renier","Focus Features, Film4, Blueprint Pictures",,"Dark Comedy, Comedy, Crime, Drama, Thriller",R,"United Kingdom, United States",English,1h 47m,"$45,211,126","$15,000,000 (estimated)"
Wreck-It Ralph,7.7,Rich Moore,2012,"Jim Reardon, Phil Johnston, Rich Moore","John C. Reilly, Jack McBrayer, Jane Lynch, Sarah Silverman, Alan Tudyk, Mindy Kaling, Joe Lo Truglio, Ed O'Neill, Dennis Haysbert, Edie McClurg, Raymond S. Persi, Jess Harnell, Rachael Harris, Skylar Astin, Adam Carolla, Horatio Sanz, Maurice LaMarche, Stefanie Scott","Walt Disney Pictures, Walt Disney Animation Studios",,"Buddy Comedy, Computer Animation, High-Concept Comedy, Motorsport, Quest, Urban Adventure, Adventure, Animation, Comedy, Family",PG,United States,English,1h 41m,"$471,222,950","$165,000,000 (estimated)"
Howl's Moving Castle,8.2,Hayao Miyazaki,2004,"Diana Wynne Jones, Hayao Miyazaki","Chieko Baishô, Takuya Kimura, Tatsuya Gashûin, Akihiro Miwa, Ryunosuke Kamiki, Mitsunori Isaki, Yô Ôizumi, Akio Ôtsuka, Daijirô Harada, Haruko Katô, Jean Simmons, Christian Bale, Lauren Bacall, Blythe Danner, Emily Mortimer, Josh Hutcherson, Billy Crystal, Jena Malone","DENTSU Music And Entertainment, Howl's Moving Castle Production Committee, Buena Vista Home Entertainment",,"Adventure Epic, Anime, Hand-Drawn Animation, Supernatural Fantasy, Adventure, Animation, Family, Fantasy",PG,"Japan, United States",Japanese,1h 59m,"$241,145,634","$24,000,000 (estimated)"
The Exorcist,8.1,William Friedkin,1973,William Peter Blatty,"Ellen Burstyn, Max von Sydow, Linda Blair, Lee J. Cobb, Kitty Winn, Jack MacGowran, Jason Miller, William O'Malley, Barton Heyman, Peter Masterson, Rudolf Schündler, Gina Petrushka, Robert Symonds, Arthur Storch, Thomas Bermingham, Vasiliki Maliaros, Titos Vandis, John Mahon","Hoya Productions, Warner Bros.",,"Body Horror, Supernatural Horror, Horror",R,United States,"English, Latin, Greek, French, German, Arabic, Kurdish",2h 2m,"$430,872,776","$11,000,000 (estimated)"
Predator,7.8,John McTiernan,1987,"John Thomas, Jim Thomas","Arnold Schwarzenegger, Carl Weathers, Kevin Peter Hall, Elpidia Carrillo, Bill Duke, Jesse Ventura, Sonny Landham, Richard Chaves, R.G. Armstrong, Shane Black, Steve Boyum, William H. Burton Jr., Franco Columbu, Peter Cullen, Henry Kingi, Sven-Ole Thorsen, Jack Verbois","Silver Pictures, Lawrence Gordon Productions, Twentieth Century Fox",,"Alien Invasion, Jungle Adventure, Monster Horror, One-Person Army Action, Slasher Horror, Survival, Action, Adventure, Horror, Sci-Fi",R,"United States, Mexico","English, Spanish, Russian",1h 47m,"$98,268,458","$15,000,000 (estimated)"
Jumanji: Welcome to the Jungle,7.0,Jake Kasdan,2017,"Scott Rosenberg, Chris McKenna, Erik Sommers","Dwayne Johnson, Karen Gillan, Kevin Hart, Jack Black, Rhys Darby, Bobby Cannavale, Nick Jonas, Alex Wolff, Ser'Darius Blain, Madison Iseman, Morgan Turner, Sean Buxton, Mason Guccione, Marin Hinkle, Tracey Bonner, Najah Jackson, Natasha Charles Parker, Kat Altman","Columbia Pictures, Matt Tolmach Productions, Radar Pictures",,"Body Swap Comedy, High-Concept Comedy, Jungle Adventure, Quest, Supernatural Fantasy, Action, Adventure, Comedy, Fantasy",PG-13,"United States, Australia, Canada, Mexico, India, United Kingdom",English,1h 59m,"$962,544,585","$90,000,000 (estimated)"
The Da Vinci Code,6.6,Ron Howard,2006,"Akiva Goldsman, Dan Brown","Tom Hanks, Audrey Tautou, Jean Reno, Ian McKellen, Paul Bettany, Alfred Molina, Jürgen Prochnow, Jean-Yves Berteloot, Etienne Chicot, Jean-Pierre Marielle, Marie-Françoise Audollent, Rita Davies, Francesco Carnelutti, Seth Gabel, Shane Zaza, Andy Clark, Fausto Maria Sciarappa, Joe Grossi","Columbia Pictures, Skylark Productions, Imagine Entertainment",,"Globetrotting Adventure, Suspense Mystery, Mystery, Thriller",PG-13,"United States, Malta, France, United Kingdom","English, French, Latin, Spanish",2h 29m,"$760,006,945","$125,000,000 (estimated)"
American Gangster,7.8,Ridley Scott,2007,"Steven Zaillian, Mark Jacobson","Denzel Washington, Russell Crowe, Chiwetel Ejiofor, Josh Brolin, Lymari Nadal, Ted Levine, Roger Guenveur Smith, John Hawkes, RZA, Yul Vazquez, Malcolm Goodwin, Ruby Dee, Ruben Santiago-Hudson, Carla Gugino, Skyler Fortgang, John Ortiz, Cuba Gooding Jr., Armand Assante","Relativity Media, Universal Pictures, Imagine Entertainment",,"Docudrama, Drug Crime, Gangster, Period Drama, True Crime, Biography, Crime, Drama",R,"United States, United Kingdom","English, Thai, Spanish",2h 37m,"$269,755,430","$100,000,000 (estimated)"
Glass Onion,7.1,Rian Johnson,2022,Rian Johnson,"Daniel Craig, Edward Norton, Kate Hudson, Dave Bautista, Janelle Monáe, Kathryn Hahn, Leslie Odom Jr., Jessica Henwick, Madelyn Cline, Noah Segan, Jackie Hoffman, Dallas Roberts, Ethan Hawke, Hugh Grant, Stephen Sondheim, Natasha Lyonne, Kareem Abdul-Jabbar, Serena Williams","T-Street, Netflix",,"Cozy Mystery, Satire, Whodunnit, Comedy, Crime, Drama, Mystery, Thriller",PG-13,United States,"English, French",2h 19m,"$13,280,000","$40,000,000 (estimated)"
Passengers,7.0,Morten Tyldum,2016,Jon Spaihts,"Jennifer Lawrence, Chris Pratt, Michael Sheen, Laurence Fishburne, Andy Garcia, Vince Foster, Kara Flowers, Conor Brophy, Julee Cerda, Aurora Perrineau, Lauren Farmer, Emerald Mayne, Kristin Brock, Tom Ferrari, Quansae Rutledge, Desmond Reid, Emma Clarke, Chris Edgerly","Columbia Pictures, Village Roadshow Pictures, LStar Capital",,"Space Sci-Fi, Drama, Romance, Sci-Fi, Thriller",PG-13,"United States, Australia, Hong Kong","English, Spanish, Japanese, French",1h 56m,"$303,144,152","$110,000,000 (estimated)"
The Cabin in the Woods,7.0,Drew Goddard,2011,"Joss Whedon, Drew Goddard","Kristen Connolly, Chris Hemsworth, Anna Hutchison, Fran Kranz, Jesse Williams, Richard Jenkins, Bradley Whitford, Brian White, Amy Acker, Tim DeZarn, Tom Lenk, Dan Payne, Jodelle Ferland, Dan Shea, Maya Massar, Matt Drake, Nels Lennarson, Rukiya Bernard","Lionsgate, Metro-Goldwyn-Mayer (MGM), Mutant Enemy",,"Conspiracy Thriller, Monster Horror, Psychological Horror, Slasher Horror, Supernatural Horror, Suspense Mystery, Teen Horror, Werewolf Horror, Horror, Mystery",R,"Canada, United States","English, Japanese",1h 35m,"$70,038,838","$30,000,000 (estimated)"
